artist,song,lyrics,emotion
Ariana Grande,Ariana Grande - pov (terjemahan bahasa indonesia),bait  ini seperti kamu memiliki kekuatan super mengubah menitku menjadi jam kamu mendapat lebih dari 00 sayang terbuat dari kaca caramu melihat melalui diriku kamu mengenalku lebih baik daripada diriku sepertinya tidak bisa menyembunyikan apa pun darimu bagaimana kamu menyentuh jiwaku dari luar resapi ego dan harga diriku  paduan suara aku ingin mencintaiku ooh seperti kamu mencintaiku ooh ooh untuk semua kecantikanku dan semua keburukanku juga aku ingin melihat diriku dari sudut pandangmu aku ingin mempercayai diriku percayalah seperti kamu mempercayaiku percayalah ooh karena tidak ada yang pernah mencintaiku sepertimu aku ingin melihat diriku dari sudut pandangmu  bait  aku mulai terbiasa menerima menjadi baik untuk tidak pergi aku akan mencintaimu meski aku takut oh takut belajar untuk bersyukur untuk diriku sendiri oh oh oh kamu menyukai bibirku karena bibir ini mengatakan halhal yang selalu kita takuti aku bisa merasakannya mulai mereda belajar untuk percaya pada apa yang menjadi milikku  paduan suara aku ingin mencintaiku ooh seperti kamu mencintaiku ooh ooh untuk semua kecantikanku dan semua keburukanku juga aku ingin melihat diriku dari sudut pandangmu aku ingin mempercayai diriku percayalah seperti kamu mempercayaiku  percayalah ooh karena tidak ada yang pernah mencintaiku sepertimu aku ingin melihat diriku dari sudut pandangmu   aku tidak bisa percaya atau melihatnya sendiri ketahuilah bahwa aku tidak sabar tapi sekarang aku di sini jatuh jatuh membeku perlahan mencair membuatku benar aku tidak akan membuatmu menunggu menunggu semua bebanku memudar dengan aman bebanku memudar dan jika mataku menipu diriku tidak akan membiarkannya menyimpang terlalu jauh  paduan suara aku ingin mencintai diriku ooh seperti kamu mencintaiku ooh ooh untuk semua kecantikanku dan semua keburukanku juga aku ingin melihat diriku dari sudut pandangmu aku ingin mempercayai diriku ooh percayalah seperti kamu mempercayaiku sayang percayalah karena tidak ada yang pernah mencintaiku sepertimu aku ingin melihat diriku dari sudut pandangmu oh yeah,joy
Beyoncé,One Night Only (Disco),haaaa come on baby haaaa one night haaaa one night only you want all my love and my devotion you want my loving soul right on the line i had no doubt that i could love you forever the only trouble is i really don't have the time i've got one night only one night only that's all i have to spare one night only let's not pretend you care i've got one night only one night only come on we better come on one night only we only have 'til dawn we only have 'til dawn we only have 'til dawn we only have 'til dawn one night only one night only one night only oh one night only yeahyeah one night only come on come on one night only come on come on you and i will be running out of time whoo yeah come on come on whoo come on come on come on come on come on come on come on yeah come on come on one night only come on come on one night only come on come on come on come on come on come on come on come on come on come on come on,love
Beyoncé,Yes,uhhuh uhhuh uhhuh uhhuh uhhuh uhhuh   i said yes to your mama and yes to you dating me yes we can be together but you gotta wait for me the first time i say no it's like i never said yes it's like i never said yes i said yes we can be together yes you can stay with me but when i say no not tonight you actin' so ungratefully the first time i say no it's like i never said yes it's like i never said yes   you was on the wall i was with my crew you was watchin' me baby i was watchin' you slowly you walked over i maintained my cool you said hello to me i said hello to you you ask me where i'm from i asked you what you do you somehow intrigued me i thought you were so cool somewhere between hi and goodbye i felt so comfortable i felt like we could talk all night so i gave my number to you   i said yes to your mama and yes to you dating me yes we can be together but you gotta wait for me the first time i say no it's like i never said yes it's like i never said yes i said yes we can be together yes you can stay with me but when i say no not tonight you actin' so ungratefully the first time i say no it's like i never said yes it's like i never said yes   certainly you can call me baby i love to hear from you yes of course you can come and see me boy i want to get to know you more i'm feelin' you no baby not yet we can't take that next step why you getting so upset boy you act as though i never told you yes before you are so ungrateful mmm mmmm   you was at my house i was sittin' on my couch you was really buggin'' so i told you to get out i had been misjudging you you had a lotta nerve you too damn old to be so immature i hope you learn you said i move too slow i showed you to the door you said you'd call me later i said don't call no more it's cool if you can't wait for me i'm glad you let me know 'cause you show me your true face baby the first time i said no   i said yes to your mama and yes to you dating me yes we can be together but you gotta wait for me the first time i say no it's like i never said yes it's like i never said yes i said yes we can be together yes you can stay with me but when i say no not tonight you actin' so ungratefully the first time i say no it's like i never said yes it's like i never said yes i said yes to your mama and yes to you dating me yes we can be together but you gotta wait for me the first time i say no it's like i never said yes,anger
BTS (방탄소년단),고엽 (Autumn Leaves),방탄소년단의 고엽 가사   진 정국 떨어져 날리는 저기 낙엽처럼 힘없이 스러져만 가 내 사랑이 니 맘이 멀어져만 가 널 잡을 수 없어 더 더 더 잡을 수 없어 난 더 붙들 수 없어 yeah   슈가 저기 저 위태로워 보이는 낙엽은 우리를 보는 것 같아서 손이 닿으면 단숨에라도 바스라질 것만 같아서 그저 바라만 봤지 가을의 바람과 같이 어느새 차가워진 말투와 표정 관계는 시들어만 가는 게 보여 가을 하늘처럼 공허한 사이 예전과는 다른 모호한 차이 오늘따라 훨씬 더 조용한 밤 가지 위에 달린 낙엽 한 장 부서지네 끝이란 게 보여 말라가는 고엽 초연해진 마음속의 고요 제발 떨어지지 말아주오 떨어지지 말아줘 바스라지는 고엽   정국 지민 v 내 눈을 마주치는 너를 원해 다시 나를 원하는 널 원해 제발 떨어지지 말어 스러지려 하지 말어 never never fall 멀리 멀리 가지 마  post 정국 진 baby you girl 놓지 못하겠는걸 baby you girl 포기 못하겠는걸 떨어지는 낙엽들처럼 이 사랑이 낙엽들처럼 never never fall 시들어가고 있어   rm 모든 낙엽은 떨어지듯이 영원할 듯하던 모든 건 멀어지듯이 너는 나의 다섯 번째 계절 널 보려 해도 볼 수 없잖아 봐 넌 아직 내겐 푸른색이야 마음은 걷지 않아도 저절로 걸어지네 미련이 빨래처럼 조각조각 널어지네 붉은 추억들만 더러운 내 위에 덜어지네 내 가지를 떨지 않아도 자꾸만 떨어지네 그래 내 사랑은 오르기 위해 떨어지네 가까이 있어도 나의 두 눈은 멀어지네 벌어지네 이렇게 버려지네 추억 속에서 난 또 어려지네  interlude v never never fall yeah never never fall yeah   정국 지민 진 내 눈을 마주치는 너를 원해 다시 나를 원하는 널 원해 제발 떨어지지 말어 스러지려 하지 말어 never never fall 멀리 멀리 가지 마   v 왜 난 아직도 너를 포기 못해 난 시들어진 추억을 붙잡고 욕심인 걸까 지는 계절을 되돌리려 해 돌리려 해  4 jhope 타올라 붉게 활활 다 아름다웠지 우리의 길 위엔 근데 시들어버리고 낙엽은 눈물처럼 내리고 바람이 불고 다 멀어지네 all day 비가 쏟아지고 부서지네 마지막 잎새까지 넌 넌 넌   정국 지민 v 내 눈을 마주치는 너를 원해 다시 나를 원하는 널 원해 제발 떨어지지 말어 스러지려 하지 말어 never never fall 멀리 멀리 가지 마  post v baby you girl 놓지 못하겠는걸 baby you girl 포기 못하겠는걸 떨어지는 낙엽들처럼 이 사랑이 낙엽들처럼 never never fall 시들어가고 있어   v never never fall never never fall,joy
BTS (방탄소년단),상남자 (Boy in Luv),jungkook 되고파 너의 오빠 너의 사랑이 난 너무 고파 되고파 너의 오빠 널 갖고 말 거야 두고 봐 fire  hook v 왜 내 맘을 흔드는 건데 왜 내 맘을 흔드는 건데 왜 내 맘을 흔드는 건데 흔드는 건데 흔드는 건데   jungkook 아빠 아빤 대체 어떻게 엄마한테 고백한 건지 편지라도 써야 될런지 뭔지 니 앞에서 난 먼지   rm 괜히 틱틱대고 씩씩대고 징징대게 돼 나는 진지한데 찌질하게 시비나 걸게 돼 뭔데 신경 쓰여 다 큰 날 애로 만들어 거꾸로 뒤집을껴 인연을 연인으로   jhope 대학까지도 너랑 간다면 참 잘 갈 것 같아 가나다라마바사아 하쿠나마타타 똑같은 프로필 사진 왜 자꾸 확인할까 그렇다고 착각하지마 쉬운 남자 아냐  pre v jungkook 안달 났어 나 안달 났어 니가 뭔데 너만 잘났어 왜 나를 자꾸 놀려 놀려 너 이제 그만 hol' up hol' up   jungkook jimin 꽉 잡아 날 덮치기 전에 내 맘이 널 놓치기 전에 say what you want say what you want 니가 진짜로 원하는 게 뭐야 꽉 잡아 날 덮치기 전에 내 맘이 널 놓치기 전에 say what you want say what you want 니가 진짜로 원하는 게 뭐야  hook v 왜 내 맘을 흔드는 건데 왜 내 맘을 흔드는 건데 왜 내 맘을 흔드는 건데 흔드는 건데 흔드는 건데  4 suga 겉으론 bad bad girl 속은 더 bad bad girl 나 같은 남잘 놓치면 후회하게 될 걸 메신저 확인해놓고 누르지 않는 너의 행위  자리 없어 짐과 동시에 속만 타지 네비게이션이나 살까봐 빠름 빠름 빠름 어필하려고 계속 난 아둥 바둥 바둥 진심 i got 'em 뒷심 i got 'em 내가 유일하게 갖지 못한 건 너의 아름 아름다움  5 rm 이 내가 어떻게 변하면 되겠니 hol' up 밀당 어장 그런 거 난 잘 몰러 대신 아프면 9 말고 날 불러 니가 울라면 울어 웃으라면 웃어 구르라면 굴러  pre jin 안달 났어 나 안달 났어 니가 뭔데 너만 잘났어 왜 나를 자꾸 놀려 놀려 너 이제 그만 hol' up hol' up   jungkook jimin 꽉 잡아 날 덮치기 전에 내 맘이 널 놓치기 전에 say what you want say what you want 니가 진짜로 원하는 게 뭐야 꽉 잡아 날 덮치기 전에 내 맘이 널 놓치기 전에 say what you want say what you want 니가 진짜로 원하는 게 뭐야 let go   jungkook jin jimin 되고파 너의 오빠 너를 향한 나의 마음을 왜 몰라 나를 모른 척해도 차가운 척해도 널 밀어내진 못하겠어 되고파 너의 오빠 너의 남자가 될 거야 두고봐 나의 마음이 네게 닿도록 지금 달려갈 거야   jungkook jimin 꽉 잡아 날 덮치기 전에 내 맘이 널 놓치기 전에 say what you want say what you want 니가 진짜로 원하는 게 뭐야 꽉 잡아 날 덮치기 전에 내 맘이 널 놓치기 전에 say what you want say what you want 니가 진짜로 원하는 게 뭐야,joy
Beyoncé,Work It Out (Azza’s Nu Soul Mix),beyoncé it's the azza yall let's work it out the remix come on work it out yeah let's work it out come on lets work it out let's work it out remix come on work it out   how you doing honey baby you know i don't ask for much but for a girl spending time alone can be pretty rough come on let's work it out but i get a knock on my door say what you know it's yours for sure uh huh we can't wait for the bedroom so we just hit the floor come on sing it y'all  pre is y'all alright i dont know but i know whats happening to me girl sing it y'all is yall alright uh break it down now break it down now is y'all alright i don't know but i know what's happening to me girl come on sing it yall is y'all alright let's work it out uh break it down now   see you gotta work it out gotta work it out see you gotta work it out gotta work it out a brotha gotta work it out oh gotta work it out   so we shaking back and forth now just keep it coming babe yeah treat my body like a  you got to you got to keep on strumming work it out but in the back of my mind i wonder is it gonna be the last time well if there ain't nobody loving and you gon' keep it coming well baby with me that's fine come on sing it  pre is y'all alright i don't know but i know what's happening to me girl sing it girl is y'all alright yeah uh break it down now break it down now is y'all alright i don't know but i know what's happening to me girl sing it girl is y'all alright uh break it down now yeah   see you gotta work it out gotta work it out see you gotta work it out gotta work it out a brotha gotta work it out oh gotta work it out remix now yeah gonna work it out yeah gonna work it out yeah we gonna work it out   so baby hold me like you don't wanna let go i'm feeling foxy 'cause boy you working it out daddy you've given me a taste of your honey i want the whole beehive i'm gonna call you my sugar 'cause i had the sweetest time let's work it out work it out now remix uh   see you gotta work it out gotta work it out see you gotta work it out gotta work it out a brotha gotta work it out gotta work it out i like it when the horn go feel that i like it when the horn go like that i like it when the horn go uh huh yeah i like it when the horn go remix now  pre is y'all alright i don't know but i know what's happening to me girl sing it girl is y'all alright yeah uh break it down now break it down now is y'all alright i don't know but i know what's happening to me girl sing it girl is y'all alright uh break it down now yeah   see you gotta work it out gotta work it out see you gotta work it out gotta work it out a brotha gotta work it out gotta work it out   yeah beyoncé look it's the azza y'all work it out the remix the remix work it out yeah we gonna work it out come on we gonna work it out yeah let's work it out remix come on work it out,anger
Billie Eilish,​guess*,lyrics from snippet can you guess what i'm thinking of,joy
BTS (방탄소년단),Outro: Ego,방탄소년단  ego 가사   rm dj friz we're now going to progress to some steps which are a bit more difficult ready set and begin bighit exclusive exclusive ddj friz 바방탄소년단   jhope 매일 돌아가 본다고 그때의 나로 포기를 선택한 삶으로 날 놓아본다고 but 세상에는 있지 변하지 않는 몆 진실 시간은 앞으로 흐른다는 것 만약은 없단 것 까마득해질 만하면 생각나 그 시절 악마의 손길과 운명의 recall 궁금해 아직도 왜 다시 불렀는지도 매일 ask me guess it 채찍 repeat oh 변할 건 없다며 결국 또 걱정을 억지로 잠궈 close how much love how much joy 위안을 주며 stay calm alone  pre jhope 그래 i don't care 전부 내 운명의 선택 so we're here 내 앞을 봐 the way is shinin' keep goin' now ready set and begin   jhope 그 길로 길로 길로 wherever my way 오직 ego ego ego just trust myself   jhope  cool  cool 4 skool 문득 스쳐가는 jhope이 아닌 정호석의 삶 hmm 희망이란 없고 후회만 가득했겠지 'til i die  cool  cool 4 skool 춤은 뜬 구름을 잡을 뿐 나의 꿈을 탓할 뿐 살아 숨쉬는 거에 의문을 oh my god god god god uh time goes by 7년의 걱정이 드디어 입 밖으로 모두 해소되는 핍박 가장 믿던 그들의 답은 내 심장으로 하나뿐인 hope 하나뿐인 soul 하나뿐인 smile 하나뿐인 너 세상 그 진실에 확실해진 답 변하지 않는 그 어떤 나 right  pre jhope 이제 i don't care 전부 내 운명의 선택 so we're here 내 앞을 봐 the way is shinin' keep goin' now ready set and begin   jhope 그 길로 길로 길로 wherever my way 오직 ego ego ego just trust myself   jhope adora 믿는 대로 가는 대로 그 길로 길로 길로 운명이 됐고 중심이 됐어 wherever my way 힘든 대로 또 슬픈 대로 오직 ego ego ego 위로가 됐고 날 알게 됐어 just trust myself map of the soul map of the all map of the soul that's my ego that's my ego map of the soul map of the all that's my ego that's my ego map of the soul,joy
Ariana Grande,Better Days - Live from One Love Manchester,ariana grande manchester put your hands up  victoria monet  ariana grande mmhmm hey hey   victoria monet baby there's a war right outside our window don't you hear the people fighting for their lives baby there's a war right outside our window but it's gon' be alright 'long as i got you with me  pre victoria monet  ariana grande in your arms i find my shelter deep in your love i will hide baby you and me stop the world when we're together you find a way to take my mind    victoria monet  ariana grande hoping for better days better days days where things are better hoping for better days better days need some better days hoping for better days better days days where things are better hoping for better days better days need some better days   ariana grande so how we gonna stop the violence stop the hurting stop the hatred stop the murders we're all human that's for certain come together we deserve it what kind of life will our babies have if we don't change up and make it last it starts right here starts right now we'll love and hope for   victoria monet  ariana grande better days better days days where things are better hoping for better days better days need some better days hoping for better days better days days where things are better hoping for better days better days need some better days hoping for better days better days days where things are better hoping for better days better days need some better days hoping for better days better days days where things are better hoping for better days better days need some better days,anger
Ariana Grande,New York Live,lyrics for this song have yet to be released please check back once the song has been released,joy
Billie Eilish,​goodbye,please please don't leave me be  verse it's not true take me to the rooftop told you not to worry what do you want from me don't ask questions wait a minute don't you know i'm no good for you baby i don't feel so good and all the good girls go to hell bite my tongue bide my time what is it about them i'm the bad guy,joy
Beyoncé,Outro,loud instruments play  beyoncé london i am i am i am yours thank you so much for all that you do all that you support all of the love all of the loyalty i love you i will continue to give you everything that i have every ounce of my being to make sure i entertain you god bless you i can't wait to see you again until next time holla  halo plays with beyoncé singing along halo halo i can see your halo halo i can feel your halo halo i can see your halo halo i can feel your halo halo i can see your halo halo i can see your halo halo i can feel your halo halo i can see your halo halo,joy
Billie Eilish,​born blue,lyrics for this song have yet to be released please check back once the song has been released,joy
Ariana Grande,​into you (live),i'm so into you i can barely breathe and all i wanna do is to fall in deep but close ain't close enough 'til we cross the line baby so name a game to play and i'll roll the dice yeah  pre oh baby look what you started the temperature's rising in here is this gonna happen been waiting and waiting for you to make a move before i   so baby come light me up and baby i'll let you on it a little bit dangerous but baby that's how i want it a little less conversation and a little more touch my body 'cause i'm so into you into you into you got everyone watchin' us so baby let's keep this secret a little bit scandalous but baby don't let them see it a little less conversation and a my body i'm so into you yeah   tell me what you came here for 'cause i can't i can't wait no more i'm on the edge with no control and i need i need you to know you to know oh yeah   so baby come light me up light me up and baby i'll let you on it a little bit dangerous a little bit dangerous but baby that's how i want it how i want it a little less conversation and a little more touch my body 'cause i'm so into you into you into you let me hear y'all one more time oh babe so baby let's keep it secret a little bit scandalous yeah oh baby london i wanna see y'all jump let's go   so come light me up so come light me up my baby little dangerous a little dangerous my boy oh yeah yeah 'cause i'm so into you into you into you,joy
Ariana Grande,​you,lyrics for this song have yet to be released please check back once the song has been released,joy
BTS (방탄소년단),"血、汗、淚 (Blood, Sweat & Tears) (Japanese Ver.)",hook jimin  jungkook 血汗涙 捧げる今も 溢れる　ただただ 血汗涙 この想いが oh 溢れる　ただただ 血汗涙   suga rm  jhope この 血汗涙と 昨日今日明日も すべて君のものだと 知ってるさそんな事など peaches and cream sweeter than sweet chocolate cheeks and chocolate wings but その羽根は悪魔みたい 逆にsweetがbitter bitter kiss me 苦しくてもいいからもう いっそ締め付けてくれ baby 酔うと知っていても君を飲む you're リスキーなウイスキー   v jungkook  jhope 血汗涙 捧げる今も 溢れる　ただただ 血汗涙 この想いが oh 溢れる　ただただ ウォネ マニ マニ マニ マニ ウォネ マニ マニ マニ マニ マニ マニ ウォネ マニ マニ マニ マニ ウォネ マニ マニ マニ マニ マニ マニ   jhope  suga 苦しくて　いいから 二度と離さぬよう 縛り付けて欲しいただ おかしくなるほど kiss me on the lips lips 二人の秘密 捕まるよう　毒される君に 君以外じゃもう従いきれない 自ら飲む毒入りの聖杯   jimin v  jhope 血汗涙 捧げる今も 溢れる　ただただ 血汗涙 この想いが oh 溢れる　ただただ ウォネ マニ マニ マニ マニ ウォネ マニ マニ マニ マニ マニ マニ ウォネ マニ マニ マニ マニ ウォネ マニ マニ マニ マニ マニ マニ   v jungkook jiminjin そっと今伝えて 終わらせてその手で どうせ無理なんて言えないよ 逃げる事もできないもう 君が甘すぎて甘すぎて甘すぎてもう   jimin 血汗涙 血汗涙,joy
Billie Eilish,​if you want me,i'll do you what you ask me if you let me be free  if you want me satisfy me,joy
BTS (방탄소년단),So Far Away (Jin & Jungkook Cover),슈가 하고 싶은 게 없다는 게 진짜 뭣 같은데 없다는 게 흔한 꿈조차 없다는 게 한심한 거 알어 다 아는데 하란 대로만 하면 된다며 대학가면 다 괜찮아 그런 말들을 믿은 내가 병신이지 나 죽지 못해 살어   슈가 술이나 좀 줘봐 술이나 좀 줘봐 오늘은 취하고 싶으니 제발 말리지 마 뭐든 좋아 뭐든 좋아 백수 새끼가 술 마시는 건 사치지만 취하지도 않음 버틸 수가 없어 ay 모두가 달리는데 왜 나만 여기 있어 ay 모두가 달리는데 왜 나만 여기 있어 ay 모두가 달리는데 왜 나만 여기서 있지   진 정국 so far away 나에게도 꿈이 있다면 날아가는 꿈이 있다면 don't fall away yea 나에게도 꿈이 있다면 날아가는 꿈이 있다면 oh oh oh  refrain 슈가 정국 dream 그대의 창조와 삶의 끝에 함께 하길 ouuuuu dream 그대의 자리가 어딜지라도 관대 하리 aaahahh dream 결국 시련의 끝에 만개하리 만개하리 dream 시작은 미약할지언정 끝은 창대하리   슈가 그래 시발 죽지 못해서 살아 살아 하고 싶은 게 없단 건 말야 말야 무엇보다 괴로운데 외로운데 주변에선 하나 같이 정신차려 란 말뿐이네 화풀이해 상대는 뭐 나뿐인데 뭘 화풀이해 매일 아침에 눈 뜨는 게 숨 쉬는 게 쉬는 게 무섭네  4 슈가 친구와 가족 조차 멀어져만 가네 ay 시간이 흐르면 흐를수록 더 조급하네 ay 나 혼자인 기분 나 혼자인 지금 모든 게 사라졌음 해 신기루 처럼 사라졌음 해 사라 졌음 해 이젠 빌어 먹을 나조차도 사라졌음 해 이렇게 세상에 나 버려지네 ay 그 순간 하늘과 멀어지네 떨어지네 떨어지네   정국 진 so far away 나에게도 꿈이 있다면 날아가는 꿈이 있다면 don't fall away 나에게도 꿈이 있다면 날아가는 꿈이 있다면 oh oh oh  refrain 슈가 정국 진 dream oh oh oh 그대의 창조와 삶의 끝에 함께 하길  oh oh oh dream 그대의 자리가 어딜지라도 관대 하리 so far away dream 결국 시련의 끝에 만개하리  ahhahahhhhm dream 시작은 미약할지언정 끝은 창대하리    정국 진 so far away so far away 나에게도 꿈이 있다면 날아가는 꿈이 있다면 don't fall away 나에게도 꿈이 있다면 날아가는 꿈이 있다면 oh oh oh  refrain 슈가 dream 그대의 창조와 삶의 끝에 함께 하길 dream 그대의 자리가 어딜지라도 관대 하리 dream 결국 시련의 끝에 만개하리 dream 시작은 미약할지언정 끝은 창대하리   슈가 정국 진 그대의 창조와 삶의 끝에 함께 하리 first love 그대의 자리가 어딜지라도 관대 하리 first love 결국 시련의 끝에 만개하리 시작은 미약할지언정 끝은 창대하리 so far away first love so far away first love so far away first love so far away first love so far away don't fall away so far away don't fall away,joy
