artist,song,lyrics,emotion
Beyoncé,Irreplaceable (Beyoncé Experience Live),to the left to the left to the left to the left mhmm   to the left to the left everything you own in the box to the left in the closet that's my stuff yes if i bought it nigga please don't touch and keep talking that mess that's fine but could you walk and talk at the same time and it's my name that's on that jag so come move your bags let me call you a cab  pre standing in the front yard tellin' me how i'm such a fool talkin' 'bout i'll never ever find a man like you you got me twisted   you must not know about me you must not know about me i could have another you in a minute matter of fact he'll be here in a minute baby you must not know about me you must not know about me i can have another you by tomorrow so don't you ever for a second get to thinking you're irreplaceable   so go ahead and get gone call up that chick and see if she's home oops i bet you thought that i didn't know what did you think i was putting you out for because you was untrue rollin' her around in the car that i bought you baby drop them keys hurry up before your taxi leaves  pre standing in the front yard tellin' me how i'm such a fool talkin' bout i'll never ever find a man like you you got me twisted   you must not know about me you must not know about me i could have another you in a minute matter of fact he'll be here in a minute baby you must not know about me you must not know about me i can have another you by tomorrow so don't you ever for a second get to thinking you're irreplaceable   so since i'm not your everything how about i'll be nothing nothing at all to you baby i won't shed a tear for you i won't lose a wink of sleep cause the truth of the matter is replacing you is so easy  interlude to the left to the left to the left to the left mmm to the left to the left everything you own in the box to the left to the left to the left don't you ever for a second get to thinking you're irreplaceable   you must not know about me you must not know about me i could have another you in a minute matter of fact he'll be here in a minute baby you must not know about me you must not know about me i can have another you by tomorrow so don't you ever for a second get to thinking baby you must not know about me you must not know about me i could have another you in a minute matter of fact he'll be here in a minute you can pack all your bags we're finished cause you made your bed now lay in it i can have another you by tomorrow don't you ever for a second get to thinking you're irreplaceable,joy
Beyoncé,Top Off (Homecoming Live),dj khaled beyoncé  jayz check this out after beyoncé perform after she done the dance coachella gotta rename coachella to beychella new name alert beychella if y'all know this one i want y'all to sing along and bop and bop bop b put the fuckboy on notice  verse beyoncé i'm the only lady here still the realest nigga in the room i break the internet top two and i ain't number two my body my ice my cash all real i'm a triple threat fuck it up and then leave come back fuck it up and leave again top off the coupe and it look like freaknik in the hood hollerin' free meek two deep it's just me and jay just posted in them courtside seats woo i'm like hol' up woo i might roll up they're tryna party with the queen they gon' have to sign a nondisclosure   beyoncé i took the top off the maybach yeah i took the top off the maybach i took the top off the maybach yeah i took the top off the maybach yeah ayy i took the top off of my maybach bitch i took the top off of my maybach bitch,joy
Beyoncé,Letter To Michelle Obama,michelle  is the ultimate example of a truly strong african american woman  she is a caring mother she's a loving wife while at the same time she is the first lady  no matter the pressure and stress of being under the microscope  she is humble loving and sincere  she builds and nurtures her family while also looking out for so many millions in so many ways  michelle thank you so much for every single thing that u do for us  i am proud to have my daughter grow up in a world where she has people like you to look upto  love beyoncé,love
Beyoncé,Lift Every Voice and Sing (Homecoming Live),lift every voice and sing 'til earth and heaven ring ring with the harmonies of liberty let our rejoicing rise high as the list'ning skies let us march on 'til victory is won,joy
Billie Eilish,​true blue*,lights out you're not here holding me i count every tear down my cheek instead of sheep   sleep walk find myself on your street three knocks ring the bell then i leave   i tried to live in black and white but i'm so blue i'd like to mean it when i say i'm over you but that's still not true   cold days frozen lake in the park old ways make mistakes when i'm lost now we've got it all  4 bad dreams might not mean anything but you seem not to need anything   i tried to live in black and white but i'm so blue i'd like to mean it when i say i'm over you but that's still not true   i'm still so blue true blue true blue hey true blue   i tried to live in black and white but i'm so blue i'd like to mean it when i say i'm over you i tried to live in black and white but i'm so blue i'd like to mean it when i say i'm over you but that's still not true   and i'm still so blue true blue true blue hey true blue,anger
Beyoncé,The Formation World Tour,north america april 7  miami fl  marlins park april 9  tampa  raymond james stadium may   atlanta ga  georgia dome may   raleigh nc  carterfinley stadium may 5  nashville tn  nissan stadium may 7  houston tx  nrg stadium may 9  dallas tx  att stadium may   san diego ca  qualcomm stadium may 4  los angeles ca  rose bowl may 6  santa clara ca  levis stadium may 8  seattle wa  centurylink field may 0  edmonton ab  commonwealth stadium may   minneapolis mn  tcf bank stadium may 5  toronto on  rogers centre may 7  chicago il  soldier field may 9  detroit mi  ford field may   pittsburgh pa  heinz field june   boston ma  gillette stadium june 5  philadelphia pa  lincoln financial field june 7  new york ny  citi field june 0  baltimore md  mt bank stadium june   hershey pa  hersheypark stadium  europe june 8  sunderland uk  stadium of light june 0  cardiff uk  millennium stadium july   london uk  wembley stadium july 5  manchester uk  emirates old trafford july 7  glasgow uk  hampden park july 9  dublin ie  croke park july   dusseldorf de  esprit arena july 4  zurich ch  letzigrund july 6  amsterdam ne  arena july 8  milan it  stadio san siro july   paris fr  stade de france july 4  copenhagen dk  parken july 6  stockholm se  friends arena july 9  frankfurt de  commerzbank arena july   brussels be  roi boudoin,joy
BTS (방탄소년단),We Are Bulletproof : The Eternal,방탄소년단 we are bulletproof the eternal 가사   jungkook v 가진 게 꿈밖에 없었네 눈 뜨면 뿌연 아침뿐 밤새 춤을 추며 노래해 그 끝이 없던 악보들   jhope ayy 우린 호기롭게 shout 다 던져봐 세상과 첫 싸움 dont wanna die but so much pain too much cryin so 무뎌지는 칼날  pre v jin jungkook oh iiiiiiii we were only seven iiiiiiii but we have you all now 일곱의 겨울과 봄 뒤에 이렇게 맞잡은 손끝에 oh iiiiiiii yeah we got to heaven   jimin v jungkook jin 내게 돌을 던져 우린 겁이 없어 anymore we are we are together bulletproof yeah we have you have you 또 겨울이 와도 누가 날 막아도 걸어가 we are we are forever bulletproof yeah we got to heaven   suga we are bulletbulletbulletproof 부정적인 시선에 맞서 우린 해냈구 나쁜 기억도 많은 시련도 다 호기롭게 우린 막아냈지 bulletproof  4 rm 늘 생각해 아직 꿈속인 건 아닐까 길었던 겨울 끝에 온 게 진짜 봄일까 모두 비웃던 한땐 부끄럽던 이름 이건 쇠로 된 증명 bulletproof  pre oh iiiiiiii we were only seven iiiiiiii but we have you all now 일곱의 겨울과 봄 뒤에 이렇게 맞잡은 손끝에 oh iiiiiiii yeah we got to heaven   jimin jungkook jin v 내게 돌을 던져 우린 겁이 없어 anymore we are we are together bulletproof yeah we have you have you 또 겨울이 와도 누가 날 막아도 걸어가 we are we are forever bulletproof yeah we got to heaven   jimin jungkook v jin oh oh oh oh 다신 멈추지 않을래 여기 우리가 함께이기에 no no tell me your every story tell me why you don't stop this tell me why you still walkin' walkin' with us yeah we got to heaven  chrous jimin jungkook jin v 내게 돌을 던져 우린 겁이 없어 anymore we are we are together bulletproof yeah we have you have you 또 겨울이 와도 누가 날 막아도 걸어가 we are we are forever bulletproof yeah we got to heaven   jungkook yeah we have you have you yeah we are not seven with you yeah we are not seven with you yeah we are not seven with you,joy
Ariana Grande,Quit (Demo),ariana grande  sia and you say that i'm the devil you know and i don't disagree no i don't see the harm they say you crazy just leave him he'll suffocate you but i wanna be in your arms they say no don't pick up the phone let them think there's nobody home but i'm under your spell 'cause when you call my heart starts to roll i always want more it's my heaven my hell  pre ariana grande  sia we're heading deep inside lives a voice a voice so quiet but i can't hear that voice when your heart beats next to mine   ariana grande sia  both i can't quit you i can't quit you i can't quit you i can't quit you  post ariana grande  sia yeah i'm gonna regret it yeah i'm gonna regret it yeah i'm gonna regret it i know i'm gonna regret it   ariana grande when you said baby i just want you to lay me down and we'll fuck the pain away 'cause skin on skin i feel nothing but the burning of desire and that's just foreplay  pre ariana grande  sia we're heading deep inside lives a voice a voice so quiet but i can't hear that voice when your heart beats next to mine   ariana grande sia  both i can't quit you i can't quit you i can't quit you i can't quit you  post ariana grande  sia yeah i'm gonna regret it yeah i'm gonna regret it yeah i'm gonna regret it i know i'm gonna regret it   ariana grande  sia i can't quit you i can't quit you oh baby i can't quit you i can't quit you oh babe gonna regret it yeah i'm gonna regret it yeah i'm gonna regret it i'm gonna regret it i'm gonna regret it gonna regret it yeah i'm gonna regret it,anger
Beyoncé,Check on It (Homecoming Live),beyoncé can i take this back sing it y'all   background singers with beyoncé ooh boy you looking like you like what you see wont you come over and check up on it i might let you work up on it ladies let 'em check up on it watch it while he check up on it dip it pop it twerk it stop it check on me tonight  verse beyoncé if you got it flaunt it boy i know you want it while i turn around you watch me check up on it ooh you watchin' me shake it i see it in ya face you cant take it it's blazin' you watch me in amazement you can look at it as long as you don't grab it if you don't go braggin' i might let you have it you think that i'm teasin' but i aint got no reason im sure that i can please ya but first i gotta read you   background singers  beyoncé ooh boy you looking like you like what you see hey won't you come over and check up on it ima let you work up on it i wanna see y'all do the dance ladies let 'em check up on it watch it while he check up on it you ready i'm watching to see if you know it dip it pop it twerk it stop it check on me tonight ooh boy you looking like you like what you see wont you come over and check up on it i'ma let you work up on it ladies let 'em check up on it watch it while he check up on it dip it pop it twerk it stop it check on me tonight   0 9 8 7 6 5 4,joy
Beyoncé,Back Up,when you see that girl comin' back up she ain't yo' average chickback up this is for the the the club and this is for the people on the the the block when you see that girl comin' back up she ain't yo average chickback up this is for the the the club and this is for the people on the the the block she ain't the average chick she the baddest chick she ain't the average chick she the baddest chick   everybody know that face even with her head low they still know that shape when she come through the club people take they place chicks throwin' handcuffs 'cause they knowin' that they man ain't safe  pre 'cause she the one switchin' up flows if it's four door two gotta go chicks like what kinda jeans is those and fellas watchin' like please get low   when you see that girl comin' back up she ain't yo' average chickback up this is for the the the club and this is for the people on the the the block when you see that girl comin' back up she ain't yo average chickback up this is for the the the club and this is for the people on the the the block she ain't the average chick she the baddest chick she ain't the average chick she the baddest chick   everybody can't do this some ain't gotta clue till they hear me spit achoo i spew 'cause yo' girl is sick is it the change or the hipsyou can't tell but you know it's thick  pre 'cause she the one switchin' up flows if it's four door two gotta go chicks like what kinda jeans is those and fellas watchin' like please get low   when you see that girl comin' back up she ain't yo' average chickback up this is for the the the club and this is for the people on the the the block when you see that girl comin' back up she ain't yo average chickback up this is for the the the club and this is for the people on the the the block she ain't the average chick she the baddest chick she ain't the average chick she the baddest chick   for this type of girl it's not that hard you see her 'cause she too far gone though they pray and pray for her downfall why they gotta be so envious doin' what it do fit to be a plus hey hey hey hey hey hey hey back up back up   when you see that girl comin' back up she ain't yo' average chickback up this is for the the the club and this is for the people on the the the block when you see that girl comin' back up she ain't yo average chickback up this is for the the the club and this is for the people on the the the block she ain't the average chick she the baddest chick she ain't the average chick she the baddest chick   hey hey hey hey hey hey hey hey hey hey hey hey hey back it up now whoa whoa whoa whoa whoa,sadness
Beyoncé,Best Thing I Never Had (Lars B Remix),what goes around comes back around hey what goes around comes back around hey what goes around comes back around hey what goes around comes back around hey what goes around comes back around hey what goes around comes back around hey my baby what goes around comes back around hey my baby what goes around comes back around hey   there was a time i thought that you did everything right no lies no wrong boy i must've been out of my mind  pre  so when i think of the time that i almost loved you you showed your ass and i i saw the real you thank god you blew it thank god i dodged the bullet i'm so over you so baby good looking out    i wanted you bad i'm so through with that 'cause honestly you turned out to be the best thing i never had you turned out to be the best thing i never had and i'm gon' always be the best thing you never had oh i bet it sucks to be you right now   so sad you're hurt boo hoo oh did you expect me to care you don't deserve my tears i guess that's why they ain't there  pre  to i think that there was a time that i almost loved you you showed your ass and baby yes i saw the real you thank god you blew it thank god i dodged the bullet i'm so over you baby good looking out    i wanted you bad i'm so through with that 'cause honestly you turned out to be the best thing i never had i said you turned out to be the best thing i never had and i'll never be the best thing you never had oh baby i bet it sucks to be you right now   i know you want me back it's time to face the facts that i'm the one that's got away lord knows that it would take another place another time another world another life thank god i found the good in goodbye    i used to want you so bad i'm so through with that 'cause honestly you turned out to be the best thing i never had oh you turned out to be the best thing i never had and i will always be the best thing you never had ooh best thing you never had i used to want you so bad i'm so through with that 'cause honestly you turned out to be the best thing i never had oh you turned out to be the best thing i never had ooh i will never be the best thing you never had oh baby i bet it sucks to be you right now   what goes around comes back around what goes around comes back around what goes around comes back around what goes around comes back around what goes around comes back around what goes around comes back around what goes around comes back around what goes around comes back around what goes around comes back around  what goes around comes back around hey what goes around comes back around hey what goes around comes back around hey what goes around comes back around hey what goes around comes back around hey what goes around comes back around hey what goes around comes back around hey what goes around comes back around hey,anger
Beyoncé,Love on Top,bring the beat in   honey honey i can see the stars all the way from here can't you see the glow on the window pane i can feel the sun whenever you're near every time you touch me i just melt away  pre now everybody asks me why i'm smiling out from ear to ear they say love hurts but i know it's gonna take a little work oh nothing's perfect but it's worth it after fighting through my tears and finally you put me first    baby it's you you're the one i love you're the one i need you're the only one i see come on baby it's you you're the one that gives your all you're the one i can always call when i need you make everything stop finally you put my love on top  post ooh come on baby you put my love on top top top top top you put my love on top ooh come on baby you put my love on top top top top top you put my love on top   baby baby i can feel the wind whipping past my face as we dance the night away boy your lips taste like a night of champagne as i kiss you again and again and again and again  pre now everybody asks me why i'm smiling out from ear to ear they say love hurts but i know it's gonna take a little work oh nothing's perfect but it's worth it after fighting through my tears and finally you put me first    baby it's you you're the one i love you're the one i need you're the only one i see come on baby it's you it's you you're the one that gives your all you're the one i can always call when i need you make everything stop finally you put my love on top  post ooh baby you put my love on top top top top top you put my love on top ooh come on baby you put my love on top top top top top you put my love on top    baby it's you you're the one i love you're the one i need you're the only thing i see come on baby it's you it's you you're the one that gives your all you're the one that always call when i need you baby everything stops finally you put my love on top baby you're the one that i love baby you're all i need you're the only one i see come on baby it's you you're the one that gives your all you're the one i always call when i need you make everything stop finally you put my love on top baby 'cause you're the one that i love baby you're the one that i need you're the only one i see baby baby it's you you're the one that gives your all you're the one that always calls when i need you everything stops finally you put my love on top baby 'cause you're the one that i love baby you're the one that i need you're the only one i see baby baby it's you you're the one that gives your all you're the one that always calls when i need you everything stops finally you put my love on top,joy
Beyoncé,Single Ladies (Put a Ring on It) [Homecoming Live],ladies have the floor ladies have the floor ladies have the ladies have the ladies have the floor hey give it up for my sister alright now everybody put your hands together do we have any single ladies in the house tonight hey now put your hands up all the single ladies all the single ladies all the single ladies all the single ladies all the single ladies all the single ladies all the single ladies now put your hands up   up in the club club we just broke up up i'm doin my own lil' thing you decided to dip dip but now you wanna trip trip 'cause another brother noticed me im up on him him he up on me me don't pay him any attention i cried my tears tears kept me three good years tears you can't be mad at me   'cause if you like it then you shoulda put a ring on it if you like it then you shoulda put a ring on it don't be mad once you see that he want it if you like it then you shoulda put a ring on it whoa oh oh oh ohoh oh oh oh oh ohoh whoa oh oh oh ohoh oh oh oh oh ohoh 'cause if you like it then you shoulda put a ring on it if you like it then you shoulda put a ring on it don't be mad once you see that he want it 'cause if you like it then you shoulda put a ring on it  interlude now wait i want yall to get nice and stanky with me where im from we do things nice and stanky we do things nice and funky can y'all repeat after me you ready say hey hey hey hey hey hey hey hey hey hey hey hey hey hey yeah hey hey yeah hey hey hey hey hey hey now wait you still aint stankin' enough for me say whoa oh oh oh ohoh oh oh oh oh ohoh whoa oh oh oh ohoh oh oh oh oh ohoh put your hands up say whoa oh oh oh ohoh oh oh oh oh ohoh put a ring on it whoa oh oh oh ohoh oh oh oh oh ohoh   say if you like it then you shoulda put a ring on it if you like it then you shoulda put a ring on it don't be mad once you see that he want it i see you if you like it then you shoulda put a ring on it whoa oh oh 'cause if you like it then you shoulda put a ring on it if you like it then you shoulda put a ring on it dont be mad once you see that he want it 'cause if you like it then you shoulda put a ring on it woah oh oh   i love y'all,joy
Beyoncé,Sweet Dreams (OK DAC Remix),every night i rush to my bed with hopes that maybe i'll get a chance to see you when i close my eyes i'm going out of my head lost in a fairytale can you hold my hands and be my guide  pre clouds filled with stars cover your skies and i hope it rains you're the perfect lullaby what kind of dream is this   you could be a sweet dream or a beautiful nightmare either way i don't wanna wake up from you turn the lights on sweet dream or a beautiful nightmare somebody pinch me your love's too good to be true turn the lights on my guilty pleasure i ain't going nowhere baby 'long as you're here i'll be floating on air 'cause you're mine you can be a sweet dream or a beautiful nightmare either way i don't wanna wake up from you turn the lights on   i mention you when i say my prayers i wrap you around all of my thoughts boy you're my temporary high i wish that when i wake up you're there to wrap your arms around me for real and tell me you'll stay by my side  pre clouds filled with stars cover the skies cover the skies and i hope it rains you're the perfect lullaby what kind of dream is this   tattoo your name across my heart so it will remain not even death could make us part what kind of dream is this   you could be a sweet dream or a beautiful nightmare either way i don't wanna wake up from you turn the lights on sweet dream or a beautiful nightmare somebody pinch me your love's too good to be true turn the lights on my guilty pleasure i ain't going nowhere baby 'long as you're here i'll be floating on air 'cause you're mine you can be a sweet dream or a beautiful nightmare either way i don't wanna wake up from you turn the lights on either way i don't wanna wake up from you,joy
